### ISSUE TITLE
Cannot visualize dataset informations in some deployed frontends behind proxys

### ISSUE THREAD

**Issue by jeandut** [SubstraFoundation/substra-frontend#51]
After registering a new dataset to be public, the dataset informations (description/openers) are not visible on some frontends deployed behind proxys.  

Inspecting one of the faulty frontend webpage gives this
```
main-15d707.js:1 Mixed Content: The page at 'https://front-mydeployedsubstra/dataset' was loaded over HTTPS, but requested an insecure resource 'http://api-deployedfrontend/data_manager/longhash/description/'. This request has been blocked; the content must be served over HTTPS.
```
Seems like url rewrite of assets is mistaken on the http/https.
All front execute a request using:
```python
request.build_absolute_uri(
        reverse('substrapp:data_manager-description', args=[data_manager['key']]))
```
[Django doc](https://docs.djangoproject.com/en/2.2/ref/request-response/#django.http.HttpRequest.build_absolute_uri) confirms that http/https depends on the request format: 

Maybe it should be based on the headers PROXY ?

**Comment by ClementGautier** [comment]
To give more context this is a case of Substra being deployed behind a Proxy. This article explain pretty well the issue: https://ubuntu.com/blog/django-behind-a-proxy-fixing-absolute-urls

What we need to make it work theorically is to enforce the parameter `settings.USE_X_FORWARDED_HOST` to `True` on Django and be sure that the `X-Forwarded-Host` header is well defined by the various proxies.

**Comment by ClementGautier** [comment]
Here it looks like the prod settings enforce those values by default: https://github.com/SubstraFoundation/substra-backend/blob/4a034869d70f26643f942571291d0debd1b26c52/backend/backend/settings/prod.py#L12 so that might be a lack of `X-Forwarded-Host` on the proxy side.

**Comment by ClementGautier** [comment]
After some debug it looks like the X-Forwarded-Proto is wrongly set:
```
Frame 86: 732 bytes on wire (5856 bits), 732 bytes captured (5856 bits)
Linux cooked capture
Internet Protocol Version 4, Src: 10.1.31.1, Dst: 10.1.31.121
Transmission Control Protocol, Src Port: 53750, Dst Port: 8000, Seq: 1, Ack: 1, Len: 664
Hypertext Transfer Protocol
    GET /favicon.ico HTTP/1.1\r\n
        [Expert Info (Chat/Sequence): GET /favicon.ico HTTP/1.1\r\n]
            [GET /favicon.ico HTTP/1.1\r\n]
            [Severity level: Chat]
            [Group: Sequence]
        Request Method: GET
        Request URI: /favicon.ico
        Request Version: HTTP/1.1
    Host: xxxxxx\r\n
    X-Request-ID: xxxx\r\n
    X-Real-IP: xxx.xxx.xxx.xxx\r\n
    X-Forwarded-For: xxx.xxx.xxx.xxx\r\n
    X-Forwarded-Host: xxxx\r\n
    X-Forwarded-Port: 80\r\n
    X-Forwarded-Proto: http\r\n
    X-Scheme: http\r\n
    User-Agent: Mozilla/5.0 (X11; Linux x86_64) AppleWebKit/537.36 (KHTML, like Gecko) Chrome/81.0.4044.122 Safari/537.36\r\n
    Accept: image/webp,image/apng,image/*,*/*;q=0.8\r\n
    Sec-Fetch-Site: same-origin\r\n
    Sec-Fetch-Mode: no-cors\r\n
    Sec-Fetch-Dest: empty\r\n
    Referer: https://xxxxxxx/\r\n
    Accept-Encoding: gzip, deflate, br\r\n
    Accept-Language: en,fr-FR;q=0.9,fr;q=0.8,en-US;q=0.7\r\n
    \r\n
    [Full request URI: http://xxxxxx/favicon.ico]
    [HTTP request 1/1]
```
It's then not a bug on the application but in the infrastructure layer.
